Date,Category,Title,Text
27 окт 2022 17:02,Политика,"Михельсон заявил, что эта зима будет для ЕС самой легкой из будущих трех","В 2023 году Европе будет «гораздо сложнее», поскольку к тому времени ее газовые резервы будут исчерпаны, заявил Михельсон"
20 сен 2022 11:00,Экономика,«Коммерсантъ» узнал о планах повысить пошлины на экспорт нефти и газа,"В результате власти рассчитывают получить в бюджет 1,4 трлн руб. в следующем году и 3,15 трлн  руб. — с 2023 по 2025 год. Главным донором станет «Газпром»"
28 апр 2022 14:01,Политика,Несколько районов Польши остались без газа из-за санкций против НОВАТЭКа,"По словам замглавы МВД Польши, несколько десятков небольших населенных пунктов остались без газа из-за санкций против НОВАТЭКа. Компания обеспечивала поставки туда сжиженного природного газа"
06 апр 2022 19:04,Политика,Лондон ввел санкции против игрока «Локомотива» и номера 4 списка Forbes,"Борис Ротенберг приходится сыном совладельцу СМП Банка, «четвертый номер» рейтинга богатейших россиян Леонид Михельсон является главой НОВАТЭКа». Всего британский санкционный список пополнили восемь человек"
04 мар 2022 23:34,Политика,НОВАТЭК вслед за ЛУКОЙЛом призвал к дипломатическому решению на Украине,"В компании заявили, что надеются на скорейшее разрешение сложившейся трагической ситуации и сочувствуют тем, кого она коснулась"
16 дек 2021 09:00,Экономика,Эксперты назвали лидеров по зарплатам среди крупнейших компаний России,"РБК представляет первый ренкинг крупнейших российских компаний реального сектора по уровню средних зарплат, составленный НКР. У лидеров — НОВАТЭКа и «Совкомфлота» — средняя зарплата превысила среднюю по России в пять раз"
28 окт 2021 23:40,Экономика,Глава НОВАТЭКа предсказал тяжелую зиму для рынка газа,"По мнению Михельсона, во втором квартале газ резко подешевеет, но к уровню 2019 года цены не вернутся"
24 сен 2021 13:14,Политика,Кремль заявил о невозможности вмешаться в дело топ-менеджера НОВАТЭКа,NO TEXT
14 дек 2020 09:01,Экономика,Эксперты назвали российские компании с наиболее эффективными инвестициями,"НОВАТЭК и РЖД оказались наиболее эффективными компаниями-инвесторами в России, показал рейтинг эффективности корпоративных инвестиций, впервые составленный агентством НКР. Лидеры рейтинга не уступили ведущим западным корпорациям"
31 янв 2020 20:21,Политика,США сняли санкции с судовой компании — перевозчика СПГ для НОВАТЭКа,Речь идет о компании Cosco Dalian — «дочке» китайской госкомпании Cosco. Под санкциями она находилась с сентября минувшего года
20 янв 2020 08:15,Экономика,СМИ узнали об увеличении доли российского газа в Европе,"По оценкам «Коммерсанта», общая доля поставок двух российских компаний по итогам минувшего года превысила 47% от импорта в страны Евросоюза"
25 ноя 2019 09:50,Экономика,«Коммерсантъ» узнал об обращении Михельсона к Путину из-за «Арктик СПГ-2»,NO TEXT
26 сен 2019 15:52,Финансы,НОВАТЭК отказался от госфинансирования для своего второго СПГ-проекта,NO TEXT
02 авг 2019 10:43,Экономика,СМИ узнали о жалобе Путину от «Газпрома» и НОВАТЭКа на схему надзора ЦБ,"Четыре компании написали письмо президенту России и попросили поддержать идею Минфина об оценке кредитных рисков компаний-заемщиков в ущерб планам ЦБ. Это письмо — фактически попытка надавить на регулятора, пишет «Коммерсантъ»"
20 июн 2019 00:01,Экономика,ЛУКОЙЛ впервые вышел в мировые лидеры по доходности для акционеров,"ЛУКОЙЛ вошел в десятку лидеров ежегодного глобального рейтинга Boston Consulting Group по совокупной акционерной стоимости. Компания щедра к своим акционерам, а кроме того, показывает хороший рост выручки"
28 май 2019 12:33,Финансы,Капитализация НОВАТЭКа превысила 4 трлн руб. на Московской бирже,NO TEXT
08 апр 2019 21:33,Экономика,НОВАТЭК ответил на упрек о потере бюджетом ₽30 млрд из-за «Ямал СПГ»,"В НОВАТЭКе не верят, что запуск «Ямал СПГ» может повлечь за собой вытеснение российского трубопроводного газа из Европы. В «Газпроме» указали, что из-за запуска проекта бюджет России недополучил 30 млрд руб."
14 фев 2019 14:34,Политика,Совладелец НОВАТЭКа прокомментировал возможные новые санкции США,NO TEXT
05 июн 2018 13:33,Политика,Зампред правления НОВАТЭКа станет первым замглавы Минприроды,"Минприроды возвращает должность первого заместителя министра, которую займет заместитель председателя правления НОВАТЭКа Денис Храмов, сообщают источники «Коммерсанта» и РБК. Он уже занимал эту должность три года назад"
20 апр 2018 15:01,Экономика,Совладелец НОВАТЭКа не увидел рисков «серьезных санкций» против компании,NO TEXT
26 июн 2017 15:23,Экономика,НОВАТЭК пообещал стать крупнейшим в мире экспортером СПГ через 10 лет,"НОВАТЭК в ближайшие десять лет планирует стать крупнейшим экспортером сжиженного газа в мире, обогнав Катар. С таким обещанием выступил финансовый директор компании Марк Джетвей, подчеркнув, что санкции США этому не помешают"
29 май 2017 17:18,Финансы,НОВАТЭК привлечет к «Ямал СПГ» €200 млн из Германии и Швеции,NO TEXT
19 май 2017 16:14,Экономика,«Газпром» не стал участвовать в аукционе на Гыданское месторождение,NO TEXT
26 янв 2017 04:35,Финансы,СМИ узнали об интересе катарского фонда к покупке доли в «Яргео»,"Катарский фонд QIA, ставший одним из акционеров «Роснефти», рассматривал покупку доли в совместном предприятии НОВАТЭКа и фонда «Энергия» Игоря Юсуфова. Об этом рассказали источники «Ведомостей»"
19 янв 2017 21:34,Экономика,Глава НОВАТЭКа не увидел перспектив скорой либерализации рынка газа,"Глава НОВАТЭКа Леонид Михельсон считает, что в ближайшие год-два не стоит ждать либерализации рынка экспорта трубопроводного газа. В октябре он впервые публично выступил за отмену монополии «Газпрома» в экспорте газа"
19 май 2016 08:06,Экономика,Правительство разрешило НОВАТЭКу пользоваться Няхартинским участком недр,NO TEXT
02 апр 2016 18:44,Политика,Правительство выступило против экспорта газа «Роснефтью» и НОВАТЭКом,"Российское правительство не поддерживает идею предоставления другим компаниям права прямого экспорта российского газа в Европу, заявил глава Минэнерго Александр Новак. Ранее об этом просили «Роснефть» и НОВАТЭК"
13 янв 2016 18:40,Финансы,Без поводов для роста: стоит ли покупать бумаги нефтегазовых компаний,"Аналитики «Ренессанс Капитала» понизили целевые цены бумаг почти всех российских нефтегазовых компаний. Они ожидают, что стоимость нефти в 2016 году составит $40 за баррель, что на 15–20% ниже их предыдущего прогноза"
13 дек 2015 22:03,Экономика,Сырье в обмен на инвестиции: зачем Дмитрий Медведев едет в Китай,"«Роснефть», «Сибур», НОВАТЭК, «Лаборатория Касперского», Yota Devices — вот неполный список компаний, чьи представители едут с премьером Дмитрием Медведевым в Китай — в гости к ведущему торговому партнеру России"
19 фев 2015 10:21,Политика,Экс-глава совета директоров НОВАТЭКа Симановский может уйти из Госдумы,NO TEXT
04 фев 2015 20:00,Финансы,"S&P снизило рейтинги «Газпрома», «Роснефти» и «МегаФона»","Международное рейтинговое агентство Standard & Poor's понизило рейтинги 14 компаний, в том числе «Газпрома», «Роснефти», НОВАТЭКа, «Транснефти» и «МегаФона» в иностранной валюте с BBB- до BB+ с «негативным» прогнозом"
24 окт 2014 22:02,Экономика,«Роснефть» встанет в общую очередь за средствами ФНБ,"«Роснефть» подала заявку на получение 2 трлн руб. из Фонда национального благосостояния, но сможет рассчитывать не более чем на 310 млрд руб. Решения по принятым проектам пересматриваться не будут, как и квоты РФПИ и «Росатома» на 580 млрд руб."
09 сен 2014 14:26,Экономика,Медведев пообещал главе НОВАТЭКа поддержать бизнес в период санкций,"Премьер-министр Дмитрий Медведев пообещал, что государство будет оказывать поддержку российскому бизнесу в условиях санкций, введенных иностранными государствами."
30 июл 2014 13:08,Экономика,Total перестала покупать акции НОВАТЭКа после крушения Boeing на Украине,Французская нефтехимическая компания Total прекратила покупать акции независимого газового производителя НОВАТЭК после крушения малайзийского Boeing 777 поблизости от Донецка 17 июля. Об этом 30 июля пишет The Wall Street Journal...
17 июл 2014 23:57,Экономика,Fitch: Санкции затруднят доступ к кредитам многим российским компаниям,"Новые санкции Вашингтона ограничат доступ на глобальные долговые рынки для многих российских компаний, а не только для Внешэкономбанка, Газпромбанка, "" Роснефти"" и НОВАТЭКа, считает международное рейтинговое агентство Fitch."
17 июл 2014 18:12,Экономика,Что на самом деле означают новые санкции США,"Власти США 16 июля расширили финансовые санкции против российских компаний. Для этого американский Минфин придумал нововведение - особый список Sectoral Sanctions Identifications List (SSI), куда попали Внешэкономбанк, Газпромбанк, ""Роснефть"" и НОВАТЭК."
15 июл 2014 09:22,Экономика,"""Башнефть"", ""Магнит"" и ""Система"" признаны лидерами по росту стоимости","Сразу шесть российских компаний вошли в составленный экспертами Boston Consulting Group (BCG) рейтинг мировых лидеров по приросту акционерной стоимости (total shareholders return, TSR). При этом три компании - ""Башнефть"", АФК..."
14 июл 2014 17:58,Экономика,Бизнес написал Медведеву о грядущем отходе от рыночной экономики,"Руководители крупнейших российских компаний, среди которых совладелец НОВАТЭКа Леонид Михельсон и гендиректор ""Северстали"" Алексей Мордашов, просят правительство не давать ходу поправкам в закон о конкуренции, наделяющим..."
27 май 2014 13:41,Экономика,На смену Газпрому в Подмосковье может прийти НОВАТЭК,"НОВАТЭК считает рынок Подмосковья интересным и перспективным и рассматривает возможность расширения поставок газа в регион, сообщил журналистам глава компании Леонид Михельсон."
22 май 2014 19:17,Экономика,"Китайцы помогли Тимченко решить проблему с финансированием ""Ямал СПГ""","Китайская сторона выделит на проект ""Ямал СПГ"" 20 млрд долл., заявил Геннадий Тимченко на Санкт-Петербургском международном экономическом форуме."
21 мар 2014 12:55,Экономика,Акции НОВАТЭКа упали в цене на 12%,"Акции НОВАТЭКа, которые сегодня на Московской бирже снижаются после объявления США о санкциях против совладельца компании Геннадия Тимченко, ускорили свое падение."
27 янв 2014 09:15,Экономика,Минэнерго согласно пустить на российский шельф только ЛУКОЙЛ,"Разработанный в Министерстве природных ресурсов и экологии законопроект, разрушающий монополию Газпрома и ""Роснефти"" на работу на континентальном шельфе России, не нашел поддержки в Министерстве энергетики, сообщает газета ""Коммерсантъ""."
14 янв 2014 16:34,Экономика,НОВАТЭК продал китайской CNPC 20% в газовом проекте на Ямале,"Компания ""НОВАТЭК"" закрыла сделку по продаже 20%-процентной доли участия в проекте ""Ямал СПГ"" компании CNODC, ""дочке"" Китайской национальной нефтегазовой корпорации (CNPC). В результате доля НОВАТЭКа в капитале ОАО ""Ямал СПГ"" сократилась до 60%, еще 20% принадлежат французской Total."
27 дек 2013 15:05,Экономика,"НОВАТЭК и ""Роснефть"" закрыли сделку по обмену активами","НОВАТЭК закрыл сделку с ""Роснефтью"" по обмену 51% ""Сибнефтегаза"" на 40% Artic Russia B.V., говорится в сообщении НОВАТЭКа. Ранее отмечалось, что сделка по обмену активами не предполагает денежных расчетов. Artic Russia B.V., в свою очередь, владеет 49% в уставном капитале ООО ""СеверЭнергия""."
23 дек 2013 13:03,Экономика,Второй завод СПГ на Ямале построят до 2025г.,"Мощность второго завода по производству сжиженного природного газа (СПГ) на Ямале может составить 15-16,5 млн т в год, его строительство запланировано до 2025г., говорится в комплексном плане по развитию производства СПГ на Ямале, поправки в который утверждены распоряжением правительства."
18 дек 2013 20:16,Экономика,"Инвестиции в проект ""Ямал СПГ"" оцениваются почти в 27 млрд долл.","Совет директоров ""Ямал СПГ"" принял окончательное инвестиционное решение по проекту разработки Южно-Тамбейского газоконденсатного месторождения и строительства завода по сжижению природного газа на полуострове Ямал, говорится в..."
20 ноя 2013 15:29,Экономика,"НОВАТЭК и Газпром выкупают у ENI долю в ""СеверЭнергии""","ООО ""Ямал развитие"" (совместное предприятие, которым на паритетной основе владеют ОАО ""НОВАТЭК"" и ОАО ""Газпром нефть"") заключило обязывающее соглашение с итальянской ENI о приобретении 60-процентной доли участия в компании Artic..."
19 ноя 2013 14:26,Экономика,"Мощность проекта ""Ямал СПГ"" могут увеличить почти в два раза","НОВАТЭК рассматривает возможность расширения проекта ""Ямал СПГ"" до 25-30 млн т в год, сообщил председатель совета директоров НОВАТЭКа Александр Наталенко на форуме ""Газ России""."
13 ноя 2013 14:05,Экономика,"Россия одобрила продажу 20% акций проекта ""Ямал СПГ"" китайской CNPC","Правительственная комиссия по контролю за иностранными инвестициями одобрила продажу 20% голосующих акций проекта ""Ямал СПГ"" китайской компании CNPC, сообщил журналистам по итогам заседания глава ФАС Игорь Артемьев."
05 ноя 2013 11:21,Экономика,Сжиженный газ с Ямала покроет 10% потребностей Испании,"Компании ""Ямал СПГ"" и испанская Gas Natural Fenosa (GNF) заключили долгосрочное соглашение на поставку 2,5 млн т сжиженного природного газа (СПГ) в год, что эквивалентно 3,2 млрд кубометров природного газа. Как сообщили в..."
22 окт 2013 09:46,Экономика,Россия и Китай договорились о нефтяном контракте на 85 млрд долл.,"Президент ""Роснефти"" Игорь Сечин и председатель совета директоров китайской компании Sinopec Фу Чэньюй подписали меморандум по экспортному контракту на условиях предоплаты. Документ подписан в ходе официального визита премьер-министра РФ Дмитрия Медведева в Китайскую Народную Республику."
10 окт 2013 13:08,Экономика,"Г.Тимченко: Мы идем в Китай, потому что там рынок","Совладелец нефтетрейдера Gunvor и газодобывающей компании НОВАТЭК Геннадий Тимченко рассматривает возможность инвестирования в газовую инфраструктуру Китая, сообщает пресс-служба инвестиционной группы Г.Тимченко Volga Group со ссылкой на интервью бизнесмена российским СМИ."
27 сен 2013 17:58,Экономика,"НОВАТЭК обсуждает продажу доли в проекте ""Ямал-СПГ"" азиатским партнерам","НОВАТЭК ведет переговоры о продаже 9% акций проекта ""Ямал-СПГ"" с индийскими, японскими и китайскими компаниями, сообщил в кулуарах сочинского форума министр энергетики РФ Александр Новак, отвечая на вопрос РБК."
25 сен 2013 11:24,Экономика,"НОВАТЭК и ""Газпром нефть"" не хотят пускать ""Роснефть"" на Ямал","""Газпром нефть"" и НОВАТЭК рассчитывают самостоятельно выкупить у итальянской компании Enel ее долю в ООО ""СеверЭнергия"", о приобретении которой вчера объявила ""Роснефть"", сообщил журналистам в кулуарах III Международного арктического форума совладелец НОВАТЭКа Геннадий Тимченко."
