Date,Category,Title,Text
23 дек 2010 17:22,Экономика,"Глава НОВАТЭКа может стать владельцем ""СИБУР Холдинга""","Председатель правления второй по величине в РФ газодобывающей компании НОВАТЭК Леонид Михельсон в скором времени может стать владельцем крупнейшего в России нефтегазохимического предприятия - ОАО ""СИБУР Холдинг"". Об этом свидетельствуют пресс-релизы, выпущенные сегодня СИБУРом и Газпромбанком."
21 дек 2010 18:00,Экономика,Г.Тимченко и Л.Михельсон могут нарастить доли в НОВАТЭКе,"Акционеры крупнейшей в России независимой газодобывающей компании НОВАТЭК Геннадий Тимченко и Леонид Михельсон смогут нарастить свои доли в ней. Принадлежащая бизнесменам на паритетных началах Hibridge Ventures Ltd. получила опцион на выкуп в ближайшие два года 9,4% акций НОВАТЭКа у Газпромбанка."
17 дек 2010 14:35,Экономика,"НОВАТЭК закрыл покупку у Газпромбанка 51% акций ""Сибнефтегаза""","ОАО ""НОВАТЭК"" закрыло сделку по приобретению у Газпромбанка 51% акций ОАО ""Сибнефтегаз"" 100-процентным дочерним обществом НОВАТЭКа - ООО ""НОВАТЭК Северо-Запад""."
13 ноя 2010 20:19,Экономика,Газпром может продать часть своей доли в НОВАТЭКе,"Газпром намерен сохранить 10-процентную долю в ОАО ""НОВАТЭК"", сообщил журналистам в Софии председатель правления Газпрома Алексей Миллер. ""10% мы не продадим"", - сказал он. В настоящее время Газпром владеет в НОВАТЭКе 19,4% акций."
12 ноя 2010 15:40,Экономика,Прибыль НОВАТЭКа в III квартале превысила 10 млрд руб.,"Чистая прибыль крупнейшей частной газодобывающей компании России ОАО ""НОВАТЭК"" выросла в III квартале 2010г. на 38% в годовом исчислении. За период с июля по сентябрь компания заработала 10,06 млрд руб., сообщается в отчете..."
11 ноя 2010 17:45,Экономика,Рост рентабельности чистой прибыли НОВАТЭКа может превысить 30%,"В пятницу, 12 ноября, НОВАТЭК планирует опубликовать финансовые результаты по МСФО за III квартал 2010г."
09 ноя 2010 13:30,Экономика,Лидеры рынка: перспективы НОВАТЭКа поддержали его акции,"В первой половине торгов во вторник, 9 ноября, на фоне преобладающей позитивной динамики российского рынка одними из лидеров стали обыкновенные акции ОАО ""НОВАТЭК""."
13 авг 2010 18:11,Экономика,"Чистая прибыль ОАО ""НОВАТЭК"" выросла до 18,3 млрд руб.","Чистая прибыль ОАО ""НОВАТЭК"" по международным стандартам финансовой отчетности (МСФО), относящаяся к акционерам компании, в I полугодии 2010г. выросла почти в 2 раза - до 18,3 млрд руб. против прибыли в размере 9,3 млрд руб., полученной за тот же период годом ранее."
26 июл 2010 20:20,Экономика,"""Газпром нефть"" и НОВАТЭК создали СП для работ на Ямале","ОАО ""Газпром нефть"" и ОАО ""НОВАТЭК"" создали совместное предприятие (СП) ООО ""Ямал развитие"", сообщили сегодня в компании. Предприятие создается на паритетных началах для реализации совместных проектов разработки нефтегазоконденсатных месторождений в Ямало-Ненецком автономном округе."
18 июн 2010 14:20,Экономика,Газпром и НОВАТЭК вместе займутся производством СПГ на Ямале,"Газпром и НОВАТЭК подписали соглашение о сотрудничестве в производстве сжиженного природного газа (СПГ) на полуострове Ямал, говорится в совместном сообщении компаний."
11 июн 2010 15:11,Экономика,Total: Очередной перенос сроков запуска Штокмана недопустим,"Компания Total считает недопустимым очередной перенос сроков запуска Штокмановского месторождения. ""Нельзя больше сдвигать сроки и, возможно, нам потребуется ваша помощь, чтобы надавить на участников проекта (с целью соблюсти..."
04 июн 2010 14:27,Экономика,НОВАТЭК будет экспортировать газ с помощью Газпрома,"Крупнейшая частная газовая компания России ОАО ""НОВАТЭК"" планирует начать поставки газа на экспорт. Соответствующий договор компании с ОАО ""Газпром"" предлагается одобрить акционерам газового монополиста, говорится в материалах к общему собранию акционеров Газпрома, намеченному на 25 июня 2010г."
14 май 2010 14:16,Экономика,Прибыль НОВАТЭКа выросла более чем в 5 раз в I квартале,"Чистая прибыль ОАО ""НОВАТЭК"" в I квартале 2010г. выросла в 5,2 раза по сравнению с показателем аналогичного периода 2009г. и составила 11,18 млрд руб. Такие данные содержатся в распространенном сегодня отчете, подготовленном по международным стандартам финансовой отчетности (МСФО)."
05 май 2010 08:58,Экономика,Арбитраж на рынках: НОВАТЭК выглядит недооцененным,"Наибольший положительный спрэд наблюдается в бумагах АФК ""Система""."
12 мар 2010 17:55,Экономика,"Чистая прибыль НОВАТЭКа по МСФО выросла в 2009г. на 13,7%","Чистая прибыль ОАО ""НОВАТЭК"" по международным стандартам финансовой отчетности (МСФО) в 2009г. выросла на 13,7% по сравнению с 2008г. и составила 26,04 млрд руб. против 22,9 млрд руб. в 2008г., говорится в сообщении компании."
12 янв 2010 12:40,Экономика,"Технический срез: ОАО ""НОВАТЭК""",Вторая волна ралли в бумагах НОВАТЭКа подходит к концу.
13 окт 2009 14:40,Экономика,"Технический срез: ОАО ""НОВАТЭК""","Котировки акций ОАО ""НОВАТЭК"" продолжают восстанавливаться после обвального падения в 2008г."
30 июл 2009 14:38,Экономика,"Технический срез: ОАО ""НОВАТЭК""","После длительного периода роста в акциях ОАО ""НОВАТЭК"" насупила консолидация."
08 апр 2009 14:16,Экономика,"Технический срез: ОАО ""НОВАТЭК""","С технической точки зрения акции НОВАТЭКа обозначили уверенный разворот в форме ""двойного дна"" в декабре 2008г."
19 мар 2009 11:15,Экономика,Отчетность НОВАТЭКа за 2008г. не разочаровала,"ОАО ""НОВАТЭК"" обнародовало отчетность за 2008г. по МСФО"
22 янв 2009 13:27,Экономика,"Технический срез: ОАО ""НОВАТЭК""","Несмотря на активное падение котировок акций НОВАТЭКа, с сентября 2008г. на графике начала формироваться фигура ""бычий клин"""
30 окт 2008 16:08,Экономика,Планы НОВАТЭКа получить 29% российского рынка крайне амбициозны,"ОАО ""НОВАТЭК рассчитывает увеличить долю присутствия на российском рынке до более 29%"
23 сен 2008 13:38,Экономика,Опережение планов принесет НОВАТЭКу дополнительную прибыль,"ОАО ""НОВАТЭК"" ввело в эксплуатацию вторую очередь Юрхаровского месторождения, сообщили в пресс-службе компании."
20 авг 2008 12:56,Экономика,НОВАТЭК начал программу приобретения GDR,"ОАО ""НОВАТЭК"" приступило к реализации программы приобретения глобальных депозитарных расписок (GDR), которая была одобрена советом директоров 11 февраля 2008г."
12 авг 2008 16:23,Экономика,"Технический срез: ОАО ""НОВАТЭК""","ОАО ""НОВАТЭК"" - второй после ""Газпрома"" производитель газа в России"
09 июн 2008 15:03,Экономика,"Технический срез: ОАО ""НОВАТЭК""","ОАО ""НОВАТЭК"" - второй после ""Газпрома"" производитель газа в России"
14 ноя 2007 17:36,Экономика,"Чистая прибыль НОВАТЭКа за 9 месяцев выросла до 11,2 млрд руб.","Чистая прибыль ОАО ""НОВАТЭК"" в январе-сентябре 2007г. по российским стандартам бухучета (РСБУ) выросла на 3,7% по сравнению с тем же периодом 2006г. и составила 11,2 млрд руб., говорится в отчете компании."
23 авг 2007 17:28,Экономика,"Чистая прибыль НОВАТЭКа за I полугодие выросла до 8,5 млрд руб.","Чистая прибыль ОАО ""НОВАТЭК"" по международным стандартам финансовой отчетности (МСФО) за первое полугодие 2007г. выросла на 19,7% - до 8 млрд 552 млн руб., сообщила пресс-служба компании."
04 апр 2007 10:12,Экономика,НОВАТЭК поборется за газовые активы ЮКОСа,"Компания группы ""НОВАТЭК"" 3 апреля 2007г. подписала договор о приобретении ООО ""Юнитекс"", которое подало заявку на участие в аукционе по продаже имущества ОАО ""НК ""ЮКОС"", составляющего лот N2. Такое сообщение распространила..."
29 мар 2007 17:49,Экономика,"Чистая прибыль НОВАТЭКа в 2006г. снизилась на 14,71%","Чистая прибыль ОАО ""НОВАТЭК"" по российским стандартам бухгалтерского учета (РСБУ) в 2006г. снизилась по сравнению с 2005г. на 14,71% и составила 12,946 млрд руб., говорится в сообщении компании."
14 ноя 2006 13:14,Экономика,"Чистая прибыль НОВАТЭКа в январе-сентябре снизилась на 10,4%","Чистая прибыль ОАО ""НОВАТЭК"" по РСБУ в январе-сентябре 2006г. снизилась по сравнению с аналогичным периодом 2005г. на 10,4% и составила 10 млрд 841 млн руб., говорится в официальном отчете компании."
29 сен 2006 12:12,Экономика,"Газпром купил 19,4% акций НОВАТЭКа","Газпром завершил сделку по приобретению 19,4% обыкновенных акций ОАО ""НОВАТЭК"", сообщает пресс-служба газового холдинга. Бумаги компании были выкуплены у ООО ""Левит"" и SWGI Growth Fund (Cyprys) Ltd. (основные акционеры НОВАТЭКа) через немецкую дочку Газпрома в лице ZGG GmbH."
26 июн 2006 17:17,Экономика,"Газпром покупает около 20% акций ОАО ""НОВАТЭК""","ОАО ""Газпром"" в лице ZGG GmbH подписало с основными акционерами ОАО ""НОВАТЭК"" - ООО ""ЛЕВИТ"" и SWGI Growth Fund (Cyprus) Limited - предварительный договор о приобретении по рыночной стоимости доли их участия в уставном капитале НОВАТЭКа в размере около 20% размещенных акций."
19 окт 2004 14:14,Экономика,В Нью-Йорке инвесторы обсудят рынок акций России,"В Нью-Йорке проходит III ежегодная нью-йоркская конференция инвесторов на тему ""Шире, глубже: Расширяющийся рынок акций России"". Организатор - инвестиционная компания ""Тройка-Диалог"". Мероприятие пройдет в West Lounge, Metropolitan Club."
